{
    "id": "anatomy-101",
    "question": "The lateral pterygoid muscle",
    "options": {
        "A": "is attached to the coronoid process and elevates the mandible.",
        "B": "is attached to the condylar process and elevates the mandible.",
        "C": "is attached to the coronoid process and protrudes the mandible.",
        "D": "is attached to the condylar process and protrudes the mandible."
    },
    "answer": "D",
    "predict": "To answer this question, let's break it down step by step: 1. **Identify the function of the lateral pterygoid muscle**: The lateral pterygoid muscle is a muscle in the jaw that plays a key role in the movement of the mandible (lower jaw). 2. **Determine its attachments**: The lateral pterygoid muscle is attached to the lateral surface of the medial surface of the angle of the mandible (specifically, the coronoid process) and the articular disc of the temporomandibular joint. 3. **Analyze the options**: - Option A states that the lateral pterygoid muscle is attached to the coronoid process and elevates the mandible. This aligns with the known attachments and function of the lateral pterygoid muscle. - Option B states that the lateral pterygoid muscle is attached to the condylar process and elevates the mandible. This is incorrect because the condylar process is actually the part of the mandible that articulates with the temporal bone at the temporomandibular joint, and it is not the attachment point for the lateral pterygoid muscle. - Option C states that the lateral pterygoid muscle is attached to the coronoid process and protrudes the mandible. This is incorrect because the lateral pterygoid muscle actually helps to elevate the mandible, not protrude it. - Option D states that the lateral pterygoid muscle is attached to the condylar process and protrudes the mandible. This is also incorrect for the same reason as option C. 4. **Conclusion**: Based on the known anatomy and function of the lateral pterygoid muscle, the correct answer is the one that correctly describes its attachments and function. Here is the output in json format: {\"step_by_step_thinking\": \"The lateral pterygoid muscle is a muscle in the jaw that plays a key role in the movement of the mandible. It is attached to the lateral surface of the medial surface of the angle of the mandible (specifically, the coronoid process) and the articular disc of the temporomandibular joint. Analyzing the options, only option A correctly describes its attachments and function. The lateral pterygoid muscle elevates the mandible when contracting. Therefore, the correct answer is A.\", \"answer_choice\": \"A\"}",
    "snippets": [],
    "scores": [],
    "execution_time": 22.58630394935608
}