{
    "id": "anatomy-100",
    "question": "Osteoclasts",
    "options": {
        "A": "deposit bone and differentiate from periosteal mesenchymal cells.",
        "B": "resorb bone and differentiate from periosteal mesenchymal cells.",
        "C": "deposit bone and differentiate from monocytes.",
        "D": "resorb bone and differentiate from monocytes."
    },
    "answer": "D",
    "predict": "{\"step_by_step_thinking\": \"To answer this question, we need to understand the role of osteoclasts in bone metabolism. Osteoclasts are specialized cells responsible for bone resorption, which is the process of breaking down bone tissue. This process is essential for bone remodeling, allowing for bone growth, repair, and adaptation to changing physiological demands. Now, let's examine each option to determine the correct answer. Option A: deposit bone and differentiate from periosteal mesenchymal cells. This is incorrect because osteoclasts are responsible for bone resorption, not bone deposition. Option B: resorb bone and differentiate from periosteal mesenchymal cells. This is incorrect because osteoclasts do not differentiate from periosteal mesenchymal cells. Osteoclasts are derived from hematopoietic cells, specifically from monocytes/macrophages. Option C: deposit bone and differentiate from monocytes. This is incorrect because osteoclasts are involved in bone resorption, not bone deposition. Additionally, osteoclasts differentiate from monocytes/macrophages, but they do not deposit bone. Option D: resorb bone and differentiate from monocytes. This is the correct answer because osteoclasts are specialized cells that resorb bone tissue, and they differentiate from monocytes/macrophages. This process is crucial for bone remodeling and homeostasis. Therefore, the correct answer is Option D: resorb bone and differentiate from monocytes.\"}",
    "snippets": [],
    "scores": [],
    "execution_time": 8.583739280700684
}