{
    "id": "college_biology-008",
    "question": "The concept of punctuated equilibrium refers to",
    "options": {
        "A": "oscillating ecological successional stages",
        "B": "ecological succession arrested by sudden environmental changes, e.g., fire",
        "C": "persistent predator-prey relationships in relatively stable environments",
        "D": "bursts of speciation followed by relatively unchanging lineages"
    },
    "answer": "D",
    "predict": "To answer this question, let's break it down step by step: 1. **Understanding the concept**: The term \"punctuated equilibrium\" was coined by paleontologist Niles Eldredge and biologist Stephen Jay Gould in 1972. It refers to a theory in evolutionary biology that challenges the traditional view of gradual, continuous evolution. 2. **Identifying key components**: The concept involves two main components: - Punctuations: Sudden events or changes that lead to the formation of new species or significant evolutionary changes. - Equilibrium: A relatively stable state that follows these punctuations, where the species that have survived the changes become the dominant forms. 3. **Analyzing the options**: - Option A: Oscillating ecological successional stages refers to the repeated cycles of ecological succession, where an ecosystem goes through a series of stages, but it doesn't directly relate to the concept of punctuated equilibrium. - Option B: Ecological succession arrested by sudden environmental changes, e.g., fire, refers to the impact of sudden events on ecosystems, but it's not the core idea of punctuated equilibrium. - Option C: Persistent predator-prey relationships in relatively stable environments describes a type of ecological interaction, not directly related to the concept of punctuated equilibrium. - Option D: Bursts of speciation followed by relatively unchanging lineages describes the idea of punctuated equilibrium, where there are sudden bursts of evolution (speciation) followed by a relatively stable period where the new species become established. 4. **Choosing the correct answer**: Based on the analysis, the correct answer is the one that accurately describes the concept of punctuated equilibrium. ```json {\"step_by_step_thinking\": \"The concept of punctuated equilibrium refers to a theory in evolutionary biology that challenges the traditional view of gradual, continuous evolution. It involves two main components: punctuations (sudden events or changes leading to new species) and equilibrium (a relatively stable state following these changes). Analyzing the options, the correct answer is the one that describes bursts of speciation followed by relatively unchanging lineages.\", \"answer_choice\": \"D\"} ```",
    "snippets": [],
    "scores": [],
    "execution_time": 38.74972343444824
}