{
    "id": "medical_genetics-015",
    "question": "QTL analysis is used to",
    "options": {
        "A": "identify chromosome regions associated with a complex trait in a genetic cross",
        "B": "determine which genes are expressed at a developmental stage",
        "C": "map genes in bacterial viruses",
        "D": "identify RNA polymerase binding sites"
    },
    "answer": "A",
    "predict": "To approach this question step-by-step: 1. QTL stands for Quantitative Trait Locus. It is a term used in genetics to describe a region of the genome that influences the variation in a continuous trait or characteristic. 2. The primary goal of QTL analysis is to identify the genetic factors that contribute to the variation in a particular trait. 3. This is typically done in the context of genetic mapping, where researchers try to pinpoint the location of genes that affect a specific trait. 4. The trait is often a complex trait, meaning it is influenced by multiple genes and environmental factors, making it difficult to identify a single gene responsible for the trait. 5. Given this understanding, the correct answer should be related to identifying genetic regions associated with complex traits. Now, considering the options: - Option A: \"identify chromosome regions associated with a complex trait in a genetic cross\" aligns with the definition of QTL analysis. - Option B: \"determine which genes are expressed at a developmental stage\" is more related to gene expression analysis, not QTL analysis. - Option C: \"map genes in bacterial viruses\" is not relevant to QTL analysis, as QTL analysis is used to study genetic variation in organisms, not viruses. - Option D: \"identify RNA polymerase binding sites\" is related to molecular biology, but not directly related to QTL analysis. Therefore, the correct answer is: {\"step_by_step_thinking\": \"QTL analysis is used to identify chromosome regions associated with a complex trait in a genetic cross, which is the primary goal of identifying the genetic factors contributing to variation in a continuous trait.\", \"answer_choice\": \"A\"}",
    "snippets": [],
    "scores": [],
    "execution_time": 27.67485547065735
}