{
    "id": "medical_genetics-021",
    "question": "X-chromosome inactivation",
    "options": {
        "A": "results in genetically turning off one of the two X chromosomes in female mammals",
        "B": "takes place in humans so that the same X chromosome is inactive in all of the cells of a female",
        "C": "is the cause of the Y chromosome being genetically inactive",
        "D": "occurs in fruit flies but not in mammals"
    },
    "answer": "A",
    "predict": "To answer this question, let's break it down step by step: 1. **Understanding X-chromosome inactivation**: X-chromosome inactivation is a process that occurs in female mammals to ensure dosage compensation between males and females. Males have one X chromosome, while females have two X chromosomes. To avoid a doubling of gene expression from the two X chromosomes, one of the X chromosomes in females is inactivated. 2. **Examining the options**: - A. results in genetically turning off one of the two X chromosomes in female mammals: This statement accurately describes the primary function of X-chromosome inactivation. - B. takes place in humans so that the same X chromosome is inactive in all of the cells of a female: This statement is incorrect. In humans, each cell has a different X chromosome that is inactivated, not the same one. - C. is the cause of the Y chromosome being genetically inactive: This statement is incorrect. X-chromosome inactivation is related to the X chromosome, not the Y chromosome. - D. occurs in fruit flies but not in mammals: This statement is incorrect. X-chromosome inactivation occurs in mammals, including humans, but not in fruit flies. 3. **Conclusion**: Based on the understanding of X-chromosome inactivation, the correct answer is the one that accurately describes the process of inactivating one of the two X chromosomes in female mammals. Here is the answer in the required format: ``` {\"step_by_step_thinking\": \"X-chromosome inactivation is a process that ensures dosage compensation between males and females by inactivating one of the two X chromosomes in female mammals. This process is not related to the Y chromosome and does not result in the same X chromosome being inactive in all cells of a female. X-chromosome inactivation occurs in mammals, including humans, and not in fruit flies.\", \"answer_choice\": \"A\"} ```",
    "snippets": [],
    "scores": [],
    "execution_time": 38.82275319099426
}